{
  "feature_id": "EX-25",
  "status": "FAIL",
  "risk": "P0",
  "summary": "Real-agent: Google Drive não está pronto: driver google_api.py não foi encontrado nos paths esperados.",
  "criteria": [
    {
      "criterion": "Driver Google compila antes de OAuth.",
      "met": false,
      "evidence": "driver=None py_compile_exit=None"
    },
    {
      "criterion": "Credencial ausente não vira PASS.",
      "met": true,
      "evidence": "credentials_available=False status=FAIL"
    },
    {
      "criterion": "SyntaxError antes da autenticação é FAIL.",
      "met": true,
      "evidence": "py_compile executado antes de OAuth real."
    }
  ],
  "artifacts": {
    "transcript": "transcript.md",
    "tool_trace": "tool_trace.jsonl",
    "evidence": "evidence.md"
  },
  "blocked_reason": null
}
