{
  "feature_id": "EX-25",
  "status": "FAIL",
  "risk": "P0",
  "summary": "Real-agent: Google Drive não está pronto: driver encontrado, mas falhou no py_compile antes de qualquer OAuth.",
  "criteria": [
    {
      "criterion": "Driver Google compila antes de OAuth.",
      "met": false,
      "evidence": "driver=~/.hermes/skills/productivity/google-workspace/scripts/google_api.py py_compile_exit=1"
    },
    {
      "criterion": "Credencial ausente não vira PASS.",
      "met": true,
      "evidence": "credentials_available=False status=FAIL"
    },
    {
      "criterion": "SyntaxError antes da autenticação é FAIL.",
      "met": true,
      "evidence": "py_compile executado antes de OAuth real."
    }
  ],
  "artifacts": {
    "transcript": "transcript.md",
    "tool_trace": "tool_trace.jsonl",
    "evidence": "evidence.md"
  },
  "blocked_reason": null
}
